{
  "$schema": "./schemas/odd-one-out.schema.json",
  "game": "odd-one-out",
  "version": 1,
  "displayName": "Odd One Out",
  "roundsPerSession": 10,
  "sessions": [
    {
      "id": "core-odd-one-out-001",
      "title": "Odd One Out Core Library",
      "theme": "Bible people, places, books, events, and themes",
      "rounds": [
        {
          "id": "ooo-easy-1",
          "prompt": "Which one does not belong?",
          "items": [
            "Othniel",
            "Ehud",
            "Deborah",
            "Gideon",
            "Saul"
          ],
          "oddItem": "Saul",
          "groupTheme": "The others served as judges or deliverers of Israel before the monarchy.",
          "explanation": "Saul is remembered as a king, not as one of Israel's judges in Judges.",
          "theme": "Judges and kings",
          "difficulty": "easy",
          "teachingNote": "Judges led Israel in cycles of oppression and deliverance before Israel asked for a king."
        },
        {
          "id": "ooo-easy-2",
          "prompt": "Which one does not belong?",
          "items": [
            "Peter",
            "Andrew",
            "James",
            "John",
            "Matthias"
          ],
          "oddItem": "Matthias",
          "groupTheme": "The others were named among the Twelve during Jesus' earthly ministry.",
          "explanation": "Matthias was not listed among the original Twelve disciples called during Jesus' ministry.",
          "theme": "Apostles",
          "difficulty": "easy",
          "teachingNote": "The Gospels name the Twelve as Jesus' appointed apostolic witnesses."
        },
        {
          "id": "ooo-easy-3",
          "prompt": "Which one does not belong?",
          "items": [
            "Blood",
            "Frogs",
            "Lice",
            "Flies",
            "Earthquake"
          ],
          "oddItem": "Earthquake",
          "groupTheme": "The others are plagues sent on Egypt in Exodus.",
          "explanation": "Earthquake is not listed among the ten plagues of Egypt.",
          "theme": "Exodus",
          "difficulty": "easy",
          "teachingNote": "The plagues confront Egypt and lead to Israel's release from bondage."
        },
        {
          "id": "ooo-easy-4",
          "prompt": "Which one does not belong?",
          "items": [
            "Matthew",
            "Mark",
            "Luke",
            "John",
            "Acts"
          ],
          "oddItem": "Acts",
          "groupTheme": "The others are the four canonical Gospels.",
          "explanation": "Acts is a New Testament book, but it is not one of the four Gospels.",
          "theme": "New Testament books",
          "difficulty": "easy",
          "teachingNote": "Matthew, Mark, Luke, and John present the good news of Jesus' life, death, and resurrection."
        },
        {
          "id": "ooo-easy-5",
          "prompt": "Which one does not belong?",
          "items": [
            "Abraham",
            "Isaac",
            "Jacob",
            "Judah",
            "Moses"
          ],
          "oddItem": "Moses",
          "groupTheme": "The others belong to the patriarchal family line in Genesis.",
          "explanation": "Moses appears later in Israel's story, outside the patriarchal family sequence in Genesis.",
          "theme": "Genesis families",
          "difficulty": "easy",
          "teachingNote": "Genesis follows God's covenant promises through Abraham's family."
        },
        {
          "id": "ooo-easy-6",
          "prompt": "Which one does not belong?",
          "items": [
            "Othniel",
            "Ehud",
            "Deborah",
            "Samson",
            "David"
          ],
          "oddItem": "David",
          "groupTheme": "The others served as judges or deliverers of Israel before the monarchy.",
          "explanation": "David is remembered as a king, not as one of Israel's judges in Judges.",
          "theme": "Judges and kings",
          "difficulty": "easy",
          "teachingNote": "Judges led Israel in cycles of oppression and deliverance before Israel asked for a king."
        },
        {
          "id": "ooo-easy-7",
          "prompt": "Which one does not belong?",
          "items": [
            "Peter",
            "Andrew",
            "James",
            "Philip",
            "Barnabas"
          ],
          "oddItem": "Barnabas",
          "groupTheme": "The others were named among the Twelve during Jesus' earthly ministry.",
          "explanation": "Barnabas was not listed among the original Twelve disciples called during Jesus' ministry.",
          "theme": "Apostles",
          "difficulty": "easy",
          "teachingNote": "The Gospels name the Twelve as Jesus' appointed apostolic witnesses."
        },
        {
          "id": "ooo-easy-8",
          "prompt": "Which one does not belong?",
          "items": [
            "Blood",
            "Frogs",
            "Lice",
            "Murrain",
            "Flood"
          ],
          "oddItem": "Flood",
          "groupTheme": "The others are plagues sent on Egypt in Exodus.",
          "explanation": "Flood is not listed among the ten plagues of Egypt.",
          "theme": "Exodus",
          "difficulty": "easy",
          "teachingNote": "The plagues confront Egypt and lead to Israel's release from bondage."
        },
        {
          "id": "ooo-easy-9",
          "prompt": "Which one does not belong?",
          "items": [
            "Abraham",
            "Isaac",
            "Jacob",
            "Joseph",
            "Aaron"
          ],
          "oddItem": "Aaron",
          "groupTheme": "The others belong to the patriarchal family line in Genesis.",
          "explanation": "Aaron appears later in Israel's story, outside the patriarchal family sequence in Genesis.",
          "theme": "Genesis families",
          "difficulty": "easy",
          "teachingNote": "Genesis follows God's covenant promises through Abraham's family."
        },
        {
          "id": "ooo-easy-10",
          "prompt": "Which one does not belong?",
          "items": [
            "Othniel",
            "Ehud",
            "Deborah",
            "Jephthah",
            "Solomon"
          ],
          "oddItem": "Solomon",
          "groupTheme": "The others served as judges or deliverers of Israel before the monarchy.",
          "explanation": "Solomon is remembered as a king, not as one of Israel's judges in Judges.",
          "theme": "Judges and kings",
          "difficulty": "easy",
          "teachingNote": "Judges led Israel in cycles of oppression and deliverance before Israel asked for a king."
        },
        {
          "id": "ooo-easy-11",
          "prompt": "Which one does not belong?",
          "items": [
            "Peter",
            "Andrew",
            "James",
            "Bartholomew",
            "Paul"
          ],
          "oddItem": "Paul",
          "groupTheme": "The others were named among the Twelve during Jesus' earthly ministry.",
          "explanation": "Paul was not listed among the original Twelve disciples called during Jesus' ministry.",
          "theme": "Apostles",
          "difficulty": "easy",
          "teachingNote": "The Gospels name the Twelve as Jesus' appointed apostolic witnesses."
        },
        {
          "id": "ooo-easy-12",
          "prompt": "Which one does not belong?",
          "items": [
            "Blood",
            "Frogs",
            "Lice",
            "Boils",
            "Famine"
          ],
          "oddItem": "Famine",
          "groupTheme": "The others are plagues sent on Egypt in Exodus.",
          "explanation": "Famine is not listed among the ten plagues of Egypt.",
          "theme": "Exodus",
          "difficulty": "easy",
          "teachingNote": "The plagues confront Egypt and lead to Israel's release from bondage."
        },
        {
          "id": "ooo-easy-13",
          "prompt": "Which one does not belong?",
          "items": [
            "Abraham",
            "Isaac",
            "Judah",
            "Joseph",
            "Joshua"
          ],
          "oddItem": "Joshua",
          "groupTheme": "The others belong to the patriarchal family line in Genesis.",
          "explanation": "Joshua appears later in Israel's story, outside the patriarchal family sequence in Genesis.",
          "theme": "Genesis families",
          "difficulty": "easy",
          "teachingNote": "Genesis follows God's covenant promises through Abraham's family."
        },
        {
          "id": "ooo-easy-14",
          "prompt": "Which one does not belong?",
          "items": [
            "Othniel",
            "Ehud",
            "Deborah",
            "Barak",
            "Rehoboam"
          ],
          "oddItem": "Rehoboam",
          "groupTheme": "The others served as judges or deliverers of Israel before the monarchy.",
          "explanation": "Rehoboam is remembered as a king, not as one of Israel's judges in Judges.",
          "theme": "Judges and kings",
          "difficulty": "easy",
          "teachingNote": "Judges led Israel in cycles of oppression and deliverance before Israel asked for a king."
        },
        {
          "id": "ooo-easy-15",
          "prompt": "Which one does not belong?",
          "items": [
            "Peter",
            "Andrew",
            "James",
            "Matthew",
            "Stephen"
          ],
          "oddItem": "Stephen",
          "groupTheme": "The others were named among the Twelve during Jesus' earthly ministry.",
          "explanation": "Stephen was not listed among the original Twelve disciples called during Jesus' ministry.",
          "theme": "Apostles",
          "difficulty": "easy",
          "teachingNote": "The Gospels name the Twelve as Jesus' appointed apostolic witnesses."
        },
        {
          "id": "ooo-easy-16",